{
  "case_id": "v21-ref-biology-digestive-path",
  "canvas": {
    "width": 800,
    "height": 1000,
    "background": "white",
    "minimum_margin_fraction": 0.05
  },
  "primitives": [
    {
      "id": "mouth-p1",
      "type": "ellipse",
      "role": "anatomy",
      "stroke": "black",
      "fill": "none",
      "line_width": 2.4,
      "bbox": [
        0.43,
        0.08,
        0.57,
        0.13
      ]
    },
    {
      "id": "esophagus-p2",
      "type": "polyline",
      "role": "anatomy",
      "stroke": "black",
      "fill": "none",
      "line_width": 5,
      "points": [
        [
          0.5,
          0.13
        ],
        [
          0.5,
          0.34
        ]
      ]
    },
    {
      "id": "stomach-p3",
      "type": "path",
      "role": "anatomy",
      "stroke": "black",
      "fill": "none",
      "line_width": 2.4,
      "commands": [
        [
          "M",
          0.5,
          0.34
        ],
        [
          "C",
          0.68,
          0.31,
          0.7,
          0.49,
          0.57,
          0.54
        ],
        [
          "C",
          0.43,
          0.52,
          0.42,
          0.39,
          0.5,
          0.34
        ],
        [
          "Z"
        ]
      ]
    },
    {
      "id": "intestine-p4",
      "type": "path",
      "role": "anatomy",
      "stroke": "black",
      "fill": "none",
      "line_width": 5,
      "commands": [
        [
          "M",
          0.57,
          0.52
        ],
        [
          "C",
          0.34,
          0.58,
          0.68,
          0.63,
          0.4,
          0.68
        ],
        [
          "C",
          0.67,
          0.73,
          0.35,
          0.78,
          0.55,
          0.84
        ]
      ]
    },
    {
      "id": "terminal-p5",
      "type": "polyline",
      "role": "anatomy",
      "stroke": "black",
      "fill": "none",
      "line_width": 5,
      "points": [
        [
          0.55,
          0.84
        ],
        [
          0.55,
          0.92
        ]
      ]
    }
  ],
  "instances": [
    {
      "id": "mouth",
      "kind": "mouth opening",
      "primitive_ids": [
        "mouth-p1"
      ]
    },
    {
      "id": "esophagus",
      "kind": "esophagus",
      "primitive_ids": [
        "esophagus-p2"
      ]
    },
    {
      "id": "stomach",
      "kind": "stomach",
      "primitive_ids": [
        "stomach-p3"
      ]
    },
    {
      "id": "intestine",
      "kind": "intestinal path",
      "primitive_ids": [
        "intestine-p4"
      ]
    },
    {
      "id": "terminal",
      "kind": "terminal tract",
      "primitive_ids": [
        "terminal-p5"
      ]
    }
  ],
  "connections": [
    {
      "from": "esophagus",
      "to": "mouth",
      "kind": "continuous_path"
    },
    {
      "from": "stomach",
      "to": "esophagus",
      "kind": "continuous_path"
    },
    {
      "from": "intestine",
      "to": "stomach",
      "kind": "continuous_path"
    },
    {
      "from": "terminal",
      "to": "intestine",
      "kind": "continuous_path"
    }
  ]
}
