{
  "case_id": "v21-ref-chemistry-diffusion-membrane",
  "canvas": {
    "width": 1200,
    "height": 800,
    "background": "white",
    "minimum_margin_fraction": 0.05
  },
  "primitives": [
    {
      "id": "container-p1",
      "type": "rect",
      "role": "boundary",
      "stroke": "black",
      "fill": "none",
      "line_width": 2.4,
      "bbox": [
        0.12,
        0.18,
        0.88,
        0.82
      ]
    },
    {
      "id": "membrane-p2",
      "type": "polyline",
      "role": "material_region",
      "stroke": "black",
      "fill": "none",
      "line_width": 3,
      "points": [
        [
          0.5,
          0.18
        ],
        [
          0.5,
          0.82
        ]
      ]
    },
    {
      "id": "particle-1-p3",
      "type": "ellipse",
      "role": "particle",
      "stroke": "black",
      "fill": "white",
      "line_width": 2.4,
      "bbox": [
        0.20500000000000002,
        0.28500000000000003,
        0.255,
        0.355
      ]
    },
    {
      "id": "particle-2-p4",
      "type": "ellipse",
      "role": "particle",
      "stroke": "black",
      "fill": "white",
      "line_width": 2.4,
      "bbox": [
        0.285,
        0.495,
        0.335,
        0.5650000000000001
      ]
    },
    {
      "id": "particle-3-p5",
      "type": "ellipse",
      "role": "particle",
      "stroke": "black",
      "fill": "white",
      "line_width": 2.4,
      "bbox": [
        0.375,
        0.6549999999999999,
        0.42500000000000004,
        0.725
      ]
    },
    {
      "id": "particle-4-p6",
      "type": "ellipse",
      "role": "particle",
      "stroke": "black",
      "fill": "white",
      "line_width": 2.4,
      "bbox": [
        0.585,
        0.355,
        0.635,
        0.42500000000000004
      ]
    },
    {
      "id": "particle-5-p7",
      "type": "ellipse",
      "role": "particle",
      "stroke": "black",
      "fill": "white",
      "line_width": 2.4,
      "bbox": [
        0.695,
        0.575,
        0.745,
        0.645
      ]
    },
    {
      "id": "solute-1-p8",
      "type": "polygon",
      "role": "particle",
      "stroke": "black",
      "fill": "white",
      "line_width": 2.4,
      "points": [
        [
          0.27,
          0.625
        ],
        [
          0.30000000000000004,
          0.66
        ],
        [
          0.27,
          0.6950000000000001
        ],
        [
          0.24000000000000002,
          0.66
        ]
      ]
    },
    {
      "id": "solute-2-p9",
      "type": "polygon",
      "role": "particle",
      "stroke": "black",
      "fill": "white",
      "line_width": 2.4,
      "points": [
        [
          0.66,
          0.255
        ],
        [
          0.6900000000000001,
          0.29
        ],
        [
          0.66,
          0.32499999999999996
        ],
        [
          0.63,
          0.29
        ]
      ]
    },
    {
      "id": "solute-3-p10",
      "type": "polygon",
      "role": "particle",
      "stroke": "black",
      "fill": "white",
      "line_width": 2.4,
      "points": [
        [
          0.78,
          0.6649999999999999
        ],
        [
          0.81,
          0.7
        ],
        [
          0.78,
          0.735
        ],
        [
          0.75,
          0.7
        ]
      ]
    }
  ],
  "instances": [
    {
      "id": "container",
      "kind": "two-compartment container",
      "primitive_ids": [
        "container-p1"
      ]
    },
    {
      "id": "membrane",
      "kind": "porous membrane",
      "primitive_ids": [
        "membrane-p2"
      ]
    },
    {
      "id": "particle-1",
      "kind": "round solute particle",
      "primitive_ids": [
        "particle-1-p3"
      ]
    },
    {
      "id": "particle-2",
      "kind": "round solute particle",
      "primitive_ids": [
        "particle-2-p4"
      ]
    },
    {
      "id": "particle-3",
      "kind": "round solute particle",
      "primitive_ids": [
        "particle-3-p5"
      ]
    },
    {
      "id": "particle-4",
      "kind": "round solute particle",
      "primitive_ids": [
        "particle-4-p6"
      ]
    },
    {
      "id": "particle-5",
      "kind": "round solute particle",
      "primitive_ids": [
        "particle-5-p7"
      ]
    },
    {
      "id": "solute-1",
      "kind": "angular solute particle",
      "primitive_ids": [
        "solute-1-p8"
      ]
    },
    {
      "id": "solute-2",
      "kind": "angular solute particle",
      "primitive_ids": [
        "solute-2-p9"
      ]
    },
    {
      "id": "solute-3",
      "kind": "angular solute particle",
      "primitive_ids": [
        "solute-3-p10"
      ]
    }
  ],
  "connections": [
    {
      "from": "particle-1",
      "to": "container",
      "kind": "contained_by"
    },
    {
      "from": "particle-2",
      "to": "container",
      "kind": "contained_by"
    },
    {
      "from": "particle-3",
      "to": "container",
      "kind": "contained_by"
    },
    {
      "from": "particle-4",
      "to": "container",
      "kind": "contained_by"
    },
    {
      "from": "particle-5",
      "to": "container",
      "kind": "contained_by"
    },
    {
      "from": "solute-1",
      "to": "container",
      "kind": "contained_by"
    },
    {
      "from": "solute-2",
      "to": "container",
      "kind": "contained_by"
    },
    {
      "from": "solute-3",
      "to": "container",
      "kind": "contained_by"
    },
    {
      "from": "membrane",
      "to": "container",
      "kind": "contained_by"
    }
  ]
}
