{
  "case_id": "v21-sketch-physics-cart-track-collision",
  "canvas": {
    "width": 1200,
    "height": 800,
    "background": "white",
    "minimum_margin_fraction": 0.05
  },
  "primitives": [
    {
      "id": "panel-p1",
      "type": "polyline",
      "role": "panel",
      "stroke": "black",
      "fill": "none",
      "line_width": 1.8,
      "points": [
        [
          0.5,
          0.1
        ],
        [
          0.5,
          0.9
        ]
      ]
    },
    {
      "id": "track-left-p2",
      "type": "polyline",
      "role": "support",
      "stroke": "black",
      "fill": "none",
      "line_width": 2.4,
      "points": [
        [
          0.09000000000000001,
          0.7
        ],
        [
          0.44000000000000006,
          0.7
        ]
      ]
    },
    {
      "id": "cart-left-1-p3",
      "type": "rect",
      "role": "apparatus",
      "stroke": "black",
      "fill": "none",
      "line_width": 2.4,
      "bbox": [
        0.11500000000000002,
        0.56,
        0.225,
        0.66
      ]
    },
    {
      "id": "wheel-left-1-a-p4",
      "type": "ellipse",
      "role": "apparatus",
      "stroke": "black",
      "fill": "none",
      "line_width": 2.4,
      "bbox": [
        0.127,
        0.65,
        0.157,
        0.69
      ]
    },
    {
      "id": "wheel-left-1-b-p5",
      "type": "ellipse",
      "role": "apparatus",
      "stroke": "black",
      "fill": "none",
      "line_width": 2.4,
      "bbox": [
        0.18300000000000002,
        0.65,
        0.21300000000000002,
        0.69
      ]
    },
    {
      "id": "cart-left-2-p6",
      "type": "rect",
      "role": "apparatus",
      "stroke": "black",
      "fill": "none",
      "line_width": 2.4,
      "bbox": [
        0.28500000000000003,
        0.56,
        0.395,
        0.66
      ]
    },
    {
      "id": "wheel-left-2-a-p7",
      "type": "ellipse",
      "role": "apparatus",
      "stroke": "black",
      "fill": "none",
      "line_width": 2.4,
      "bbox": [
        0.29700000000000004,
        0.65,
        0.327,
        0.69
      ]
    },
    {
      "id": "wheel-left-2-b-p8",
      "type": "ellipse",
      "role": "apparatus",
      "stroke": "black",
      "fill": "none",
      "line_width": 2.4,
      "bbox": [
        0.35300000000000004,
        0.65,
        0.383,
        0.69
      ]
    },
    {
      "id": "track-right-p9",
      "type": "polyline",
      "role": "support",
      "stroke": "black",
      "fill": "none",
      "line_width": 2.4,
      "points": [
        [
          0.5800000000000001,
          0.7
        ],
        [
          0.84,
          0.7
        ]
      ]
    },
    {
      "id": "cart-right-1-p10",
      "type": "rect",
      "role": "apparatus",
      "stroke": "black",
      "fill": "none",
      "line_width": 2.4,
      "bbox": [
        0.605,
        0.56,
        0.7150000000000001,
        0.66
      ]
    },
    {
      "id": "wheel-right-1-a-p11",
      "type": "ellipse",
      "role": "apparatus",
      "stroke": "black",
      "fill": "none",
      "line_width": 2.4,
      "bbox": [
        0.617,
        0.65,
        0.647,
        0.69
      ]
    },
    {
      "id": "wheel-right-1-b-p12",
      "type": "ellipse",
      "role": "apparatus",
      "stroke": "black",
      "fill": "none",
      "line_width": 2.4,
      "bbox": [
        0.673,
        0.65,
        0.7030000000000001,
        0.69
      ]
    },
    {
      "id": "cart-right-2-p13",
      "type": "rect",
      "role": "apparatus",
      "stroke": "black",
      "fill": "none",
      "line_width": 2.4,
      "bbox": [
        0.6849999999999999,
        0.56,
        0.795,
        0.66
      ]
    },
    {
      "id": "wheel-right-2-a-p14",
      "type": "ellipse",
      "role": "apparatus",
      "stroke": "black",
      "fill": "none",
      "line_width": 2.4,
      "bbox": [
        0.697,
        0.65,
        0.727,
        0.69
      ]
    },
    {
      "id": "wheel-right-2-b-p15",
      "type": "ellipse",
      "role": "apparatus",
      "stroke": "black",
      "fill": "none",
      "line_width": 2.4,
      "bbox": [
        0.753,
        0.65,
        0.783,
        0.69
      ]
    }
  ],
  "instances": [
    {
      "id": "panel",
      "kind": "two-state divider",
      "primitive_ids": [
        "panel-p1"
      ]
    },
    {
      "id": "track-left",
      "kind": "horizontal track",
      "primitive_ids": [
        "track-left-p2"
      ]
    },
    {
      "id": "cart-left-1",
      "kind": "cart body",
      "primitive_ids": [
        "cart-left-1-p3"
      ]
    },
    {
      "id": "wheel-left-1-a",
      "kind": "wheel",
      "primitive_ids": [
        "wheel-left-1-a-p4"
      ]
    },
    {
      "id": "wheel-left-1-b",
      "kind": "wheel",
      "primitive_ids": [
        "wheel-left-1-b-p5"
      ]
    },
    {
      "id": "cart-left-2",
      "kind": "cart body",
      "primitive_ids": [
        "cart-left-2-p6"
      ]
    },
    {
      "id": "wheel-left-2-a",
      "kind": "wheel",
      "primitive_ids": [
        "wheel-left-2-a-p7"
      ]
    },
    {
      "id": "wheel-left-2-b",
      "kind": "wheel",
      "primitive_ids": [
        "wheel-left-2-b-p8"
      ]
    },
    {
      "id": "track-right",
      "kind": "horizontal track",
      "primitive_ids": [
        "track-right-p9"
      ]
    },
    {
      "id": "cart-right-1",
      "kind": "cart body",
      "primitive_ids": [
        "cart-right-1-p10"
      ]
    },
    {
      "id": "wheel-right-1-a",
      "kind": "wheel",
      "primitive_ids": [
        "wheel-right-1-a-p11"
      ]
    },
    {
      "id": "wheel-right-1-b",
      "kind": "wheel",
      "primitive_ids": [
        "wheel-right-1-b-p12"
      ]
    },
    {
      "id": "cart-right-2",
      "kind": "cart body",
      "primitive_ids": [
        "cart-right-2-p13"
      ]
    },
    {
      "id": "wheel-right-2-a",
      "kind": "wheel",
      "primitive_ids": [
        "wheel-right-2-a-p14"
      ]
    },
    {
      "id": "wheel-right-2-b",
      "kind": "wheel",
      "primitive_ids": [
        "wheel-right-2-b-p15"
      ]
    }
  ],
  "connections": [
    {
      "from": "cart-left-1",
      "to": "track-left",
      "kind": "supported_by"
    },
    {
      "from": "cart-left-2",
      "to": "track-left",
      "kind": "supported_by"
    },
    {
      "from": "cart-right-1",
      "to": "track-right",
      "kind": "supported_by"
    },
    {
      "from": "cart-right-2",
      "to": "track-right",
      "kind": "supported_by"
    }
  ]
}
