{
  "case_id": "v21-sketch-biology-seed-germination",
  "canvas": {
    "width": 1200,
    "height": 800,
    "background": "white",
    "minimum_margin_fraction": 0.05
  },
  "primitives": [
    {
      "id": "seed-p1",
      "type": "ellipse",
      "role": "anatomy",
      "stroke": "black",
      "fill": "gray",
      "line_width": 2.4,
      "bbox": [
        0.38,
        0.3,
        0.62,
        0.55
      ]
    },
    {
      "id": "root-p2",
      "type": "path",
      "role": "anatomy",
      "stroke": "black",
      "fill": "none",
      "line_width": 2.4,
      "commands": [
        [
          "M",
          0.5,
          0.52
        ],
        [
          "C",
          0.49,
          0.64,
          0.43,
          0.72,
          0.44,
          0.86
        ]
      ]
    },
    {
      "id": "shoot-p3",
      "type": "path",
      "role": "anatomy",
      "stroke": "black",
      "fill": "none",
      "line_width": 2.4,
      "commands": [
        [
          "M",
          0.51,
          0.32
        ],
        [
          "C",
          0.54,
          0.24,
          0.56,
          0.18,
          0.54,
          0.12
        ]
      ]
    },
    {
      "id": "leaf-left-p4",
      "type": "path",
      "role": "anatomy",
      "stroke": "black",
      "fill": "none",
      "line_width": 2.4,
      "commands": [
        [
          "M",
          0.54,
          0.18
        ],
        [
          "C",
          0.43,
          0.12,
          0.39,
          0.18,
          0.54,
          0.22
        ],
        [
          "Z"
        ]
      ]
    },
    {
      "id": "leaf-right-p5",
      "type": "path",
      "role": "anatomy",
      "stroke": "black",
      "fill": "none",
      "line_width": 2.4,
      "commands": [
        [
          "M",
          0.55,
          0.16
        ],
        [
          "C",
          0.66,
          0.1,
          0.7,
          0.18,
          0.55,
          0.21
        ],
        [
          "Z"
        ]
      ]
    }
  ],
  "instances": [
    {
      "id": "seed",
      "kind": "seed body",
      "primitive_ids": [
        "seed-p1"
      ]
    },
    {
      "id": "root",
      "kind": "primary root",
      "primitive_ids": [
        "root-p2"
      ]
    },
    {
      "id": "shoot",
      "kind": "young shoot",
      "primitive_ids": [
        "shoot-p3"
      ]
    },
    {
      "id": "leaf-left",
      "kind": "first leaf",
      "primitive_ids": [
        "leaf-left-p4"
      ]
    },
    {
      "id": "leaf-right",
      "kind": "second leaf",
      "primitive_ids": [
        "leaf-right-p5"
      ]
    }
  ],
  "connections": [
    {
      "from": "root",
      "to": "seed",
      "kind": "continuous_path"
    },
    {
      "from": "shoot",
      "to": "seed",
      "kind": "continuous_path"
    },
    {
      "from": "leaf-left",
      "to": "shoot",
      "kind": "touching"
    },
    {
      "from": "leaf-right",
      "to": "shoot",
      "kind": "touching"
    }
  ]
}
