{
  "case_id": "v21-ref-physics-pendulum-two-states",
  "canvas": {
    "width": 1200,
    "height": 800,
    "background": "white",
    "minimum_margin_fraction": 0.05
  },
  "primitives": [
    {
      "id": "panel-p1",
      "type": "polyline",
      "role": "panel",
      "stroke": "black",
      "fill": "none",
      "line_width": 1.8,
      "points": [
        [
          0.5,
          0.1
        ],
        [
          0.5,
          0.9
        ]
      ]
    },
    {
      "id": "support-left-p2",
      "type": "polyline",
      "role": "support",
      "stroke": "black",
      "fill": "none",
      "line_width": 2.4,
      "points": [
        [
          0.10999999999999999,
          0.2
        ],
        [
          0.39,
          0.2
        ]
      ]
    },
    {
      "id": "string-left-p3",
      "type": "polyline",
      "role": "connector",
      "stroke": "black",
      "fill": "none",
      "line_width": 2.4,
      "points": [
        [
          0.25,
          0.2
        ],
        [
          0.18,
          0.7
        ]
      ]
    },
    {
      "id": "bob-left-p4",
      "type": "ellipse",
      "role": "apparatus",
      "stroke": "black",
      "fill": "none",
      "line_width": 2.4,
      "bbox": [
        0.145,
        0.6499999999999999,
        0.215,
        0.75
      ]
    },
    {
      "id": "support-right-p5",
      "type": "polyline",
      "role": "support",
      "stroke": "black",
      "fill": "none",
      "line_width": 2.4,
      "points": [
        [
          0.61,
          0.2
        ],
        [
          0.89,
          0.2
        ]
      ]
    },
    {
      "id": "string-right-p6",
      "type": "polyline",
      "role": "connector",
      "stroke": "black",
      "fill": "none",
      "line_width": 2.4,
      "points": [
        [
          0.75,
          0.2
        ],
        [
          0.84,
          0.7
        ]
      ]
    },
    {
      "id": "bob-right-p7",
      "type": "ellipse",
      "role": "apparatus",
      "stroke": "black",
      "fill": "none",
      "line_width": 2.4,
      "bbox": [
        0.8049999999999999,
        0.6499999999999999,
        0.875,
        0.75
      ]
    }
  ],
  "instances": [
    {
      "id": "panel",
      "kind": "two-state divider",
      "primitive_ids": [
        "panel-p1"
      ]
    },
    {
      "id": "support-left",
      "kind": "support",
      "primitive_ids": [
        "support-left-p2"
      ]
    },
    {
      "id": "string-left",
      "kind": "pendulum string",
      "primitive_ids": [
        "string-left-p3"
      ]
    },
    {
      "id": "bob-left",
      "kind": "pendulum bob",
      "primitive_ids": [
        "bob-left-p4"
      ]
    },
    {
      "id": "support-right",
      "kind": "support",
      "primitive_ids": [
        "support-right-p5"
      ]
    },
    {
      "id": "string-right",
      "kind": "pendulum string",
      "primitive_ids": [
        "string-right-p6"
      ]
    },
    {
      "id": "bob-right",
      "kind": "pendulum bob",
      "primitive_ids": [
        "bob-right-p7"
      ]
    }
  ],
  "connections": [
    {
      "from": "string-left",
      "to": "support-left",
      "kind": "supported_by"
    },
    {
      "from": "bob-left",
      "to": "string-left",
      "kind": "supported_by"
    },
    {
      "from": "string-right",
      "to": "support-right",
      "kind": "supported_by"
    },
    {
      "from": "bob-right",
      "to": "string-right",
      "kind": "supported_by"
    }
  ]
}
